{
  "protocol": "ruleoak.governance.v1",
  "bundleType": "RuleOakEvidenceBundle",
  "bundleId": "conformance-bundle-001",
  "runId": "conformance-run-001",
  "generatedAt": "2026-01-01T00:00:00.000Z",
  "records": [
    {
      "schemaVersion": "ruleoak.governance.v1",
      "recordType": "RunRecord",
      "runId": "conformance-run-001",
      "domain": "conformance",
      "workflow": "protocol-v1-fixture",
      "actor": "conformance-tester",
      "status": "completed",
      "createdAt": "2026-01-01T00:00:00.000Z",
      "updatedAt": "2026-01-01T00:00:00.000Z",
      "metadata": {
        "fixture": true,
        "purpose": "golden-record"
      }
    },
    {
      "schemaVersion": "ruleoak.governance.v1",
      "recordType": "EvidenceRecord",
      "evidenceId": "conformance-evidence-001",
      "runId": "conformance-run-001",
      "action": "read.source_document",
      "subject": "policy://access-control-baseline",
      "subjectType": "document",
      "source": "fixture",
      "metadata": {
        "sensitivity": "internal",
        "citationRequired": true
      },
      "createdAt": "2026-01-01T00:00:00.000Z",
      "hash": "3320fdc03d19f20cda11b7c8881ed01f6d60d534f9b42482aee04cb233416adc"
    },
    {
      "schemaVersion": "ruleoak.governance.v1",
      "recordType": "PolicyDecisionRecord",
      "decisionId": "conformance-decision-allow-001",
      "runId": "conformance-run-001",
      "action": "read.source_document",
      "subject": "policy://access-control-baseline",
      "effect": "allow",
      "matchedRuleIds": [
        "conformance.read.internal.allow"
      ],
      "reason": "Read-only access to internal conformance fixture is allowed.",
      "metadata": {
        "risk": "low"
      },
      "createdAt": "2026-01-01T00:00:00.000Z",
      "decision": "allowed"
    },
    {
      "schemaVersion": "ruleoak.governance.v1",
      "recordType": "PolicyDecisionRecord",
      "decisionId": "conformance-decision-approval-001",
      "runId": "conformance-run-001",
      "action": "write.production_change",
      "subject": "service://checkout/threshold",
      "effect": "approval_required",
      "matchedRuleIds": [
        "conformance.write.production.approval"
      ],
      "reason": "Production write action requires human approval.",
      "metadata": {
        "risk": "medium"
      },
      "createdAt": "2026-01-01T00:00:00.000Z",
      "decision": "approval_required"
    },
    {
      "schemaVersion": "ruleoak.governance.v1",
      "recordType": "ApprovalRecord",
      "approvalId": "conformance-approval-001",
      "runId": "conformance-run-001",
      "action": "write.production_change",
      "subject": "service://checkout/threshold",
      "decision": "approved",
      "actor": "human-reviewer",
      "reason": "Evidence and rollback plan are present.",
      "metadata": {
        "ticket": "CONF-1"
      },
      "createdAt": "2026-01-01T00:00:00.000Z"
    },
    {
      "schemaVersion": "ruleoak.governance.v1",
      "recordType": "AuditEvent",
      "eventId": "conformance-audit-001",
      "runId": "conformance-run-001",
      "eventType": "run_started",
      "action": null,
      "subject": null,
      "actor": "ruleoak",
      "policyDecision": null,
      "evidenceId": null,
      "approvalId": null,
      "metadata": {
        "workflow": "protocol-v1-fixture"
      },
      "createdAt": "2026-01-01T00:00:00.000Z",
      "sequence": 0,
      "previousHash": null,
      "eventHash": "7eff25822467b59e1823fcf6a1dc16319b2b195a811ca683e7635e0cd8620671"
    },
    {
      "schemaVersion": "ruleoak.governance.v1",
      "recordType": "AuditEvent",
      "eventId": "conformance-audit-002",
      "runId": "conformance-run-001",
      "eventType": "policy_decision_recorded",
      "action": "write.production_change",
      "subject": "service://checkout/threshold",
      "actor": "ruleoak",
      "policyDecision": "approval_required",
      "evidenceId": null,
      "approvalId": null,
      "metadata": {
        "decisionId": "conformance-decision-approval-001"
      },
      "createdAt": "2026-01-01T00:00:00.000Z",
      "sequence": 1,
      "previousHash": "7eff25822467b59e1823fcf6a1dc16319b2b195a811ca683e7635e0cd8620671",
      "eventHash": "bcb06202df957b4463e07378ff253df6e59db32ee35d022e5046472edf2c8f5a"
    },
    {
      "schemaVersion": "ruleoak.governance.v1",
      "recordType": "AuditEvent",
      "eventId": "conformance-audit-003",
      "runId": "conformance-run-001",
      "eventType": "approval_recorded",
      "action": "write.production_change",
      "subject": "service://checkout/threshold",
      "actor": "human-reviewer",
      "policyDecision": null,
      "evidenceId": null,
      "approvalId": "conformance-approval-001",
      "metadata": {
        "decision": "approved"
      },
      "createdAt": "2026-01-01T00:00:00.000Z",
      "sequence": 2,
      "previousHash": "bcb06202df957b4463e07378ff253df6e59db32ee35d022e5046472edf2c8f5a",
      "eventHash": "e80c40cdf46090c19e047fff2776925d30ca972d84cec93754cd85ed27da14e2"
    },
    {
      "schemaVersion": "ruleoak.governance.v1",
      "recordType": "ReportRecord",
      "reportId": "conformance-report-001",
      "runId": "conformance-run-001",
      "title": "RuleOak Governance Protocol v1 Conformance Report Fixture",
      "summary": {
        "allowed": 1,
        "approvalRequired": 1,
        "approved": 1,
        "blocked": 0
      },
      "records": [
        "conformance-run-001",
        "conformance-evidence-001",
        "conformance-decision-allow-001",
        "conformance-decision-approval-001",
        "conformance-approval-001",
        "conformance-audit-001",
        "conformance-audit-002",
        "conformance-audit-003"
      ],
      "metadata": {
        "fixture": true
      },
      "createdAt": "2026-01-01T00:00:00.000Z"
    }
  ],
  "recordHashes": [
    {
      "recordType": "RunRecord",
      "id": "conformance-run-001",
      "hash": "0622dffbd424a3de8afdb8fb4ba3eb671aa5c1ea1b416bcbd3f50b21f9ab612f"
    },
    {
      "recordType": "EvidenceRecord",
      "id": "conformance-evidence-001",
      "hash": "3320fdc03d19f20cda11b7c8881ed01f6d60d534f9b42482aee04cb233416adc"
    },
    {
      "recordType": "PolicyDecisionRecord",
      "id": "conformance-decision-allow-001",
      "hash": "1ac4b7016e2ecc1b5334d5ac717aea9d45eb2f6a46e4dc23e1f670370cbde0fa"
    },
    {
      "recordType": "PolicyDecisionRecord",
      "id": "conformance-decision-approval-001",
      "hash": "d87a3f4fd89688afadbf34b3bc361f0a97118e686027e1685e75872b38c68237"
    },
    {
      "recordType": "ApprovalRecord",
      "id": "conformance-approval-001",
      "hash": "b2e3eac18bf15c59351c9764d620b28de18f4fc485c5651bb2a0bdd76d0da751"
    },
    {
      "recordType": "AuditEvent",
      "id": "conformance-audit-001",
      "hash": "7eff25822467b59e1823fcf6a1dc16319b2b195a811ca683e7635e0cd8620671"
    },
    {
      "recordType": "AuditEvent",
      "id": "conformance-audit-002",
      "hash": "bcb06202df957b4463e07378ff253df6e59db32ee35d022e5046472edf2c8f5a"
    },
    {
      "recordType": "AuditEvent",
      "id": "conformance-audit-003",
      "hash": "e80c40cdf46090c19e047fff2776925d30ca972d84cec93754cd85ed27da14e2"
    },
    {
      "recordType": "ReportRecord",
      "id": "conformance-report-001",
      "hash": "6bcc111e32dd1e55490e84f262fe16b2f02175100c056746f42f23f5369b49f2"
    }
  ],
  "redactionManifest": {
    "protocol": "ruleoak.governance.v1",
    "manifestType": "RuleOakRedactionManifest",
    "manifestId": "conformance-redaction-001",
    "runId": "conformance-run-001",
    "fields": [
      {
        "path": "records[*].metadata.customerEmail",
        "method": "remove",
        "reason": "PII must not be shipped in conformance fixtures."
      }
    ],
    "reason": "Fixture demonstrates redaction metadata without containing live secrets.",
    "actor": "conformance-tester",
    "createdAt": "2026-01-01T00:00:00.000Z",
    "metadata": {
      "fixture": true
    }
  },
  "metadata": {
    "fixture": "evidence-bundle-v1"
  },
  "bundleHash": "12b1f7966ba413e6617d044cc52811beb9a77d0b9b2089ad87a16087e454aa09"
}
